{
  "schema_version": 1,
  "decision_id": "decision_01J5XKB6F9J2M5P8S1V4Y7B0D",
  "task_id": "task_01J5XK7Q2A6M8N4P0R3S5T7V9W",
  "plan_id": "plan_01J5XK8H3C6F9J2L5N8Q1S4V7Y",
  "decision_kind": "scheduling",
  "input_refs": [
    "inputs://task/01J5XK7Q/digest",
    "knowledge://acme-labs/engineering-contracts"
  ],
  "constraint_refs": [
    "constraint://quality/950",
    "constraint://cost/500000",
    "constraint://region/eu-central"
  ],
  "selected_result": {
    "capabilities": [
      "capability://leanctx/code-context",
      "capability://leanctx/tool-output-optimizer"
    ],
    "model": "model-b",
    "provider": "eu-provider-2",
    "reasoning_budget_tokens": 8000
  },
  "rationale_code": "within_quality_and_cost_constraints",
  "rationale_ref": "rationale://decision/01J5XKB6",
  "policy_ref": "policy://model/approved-v1",
  "decision_system_name": "leanctx-reference-scheduler",
  "decision_system_version": "1.0.0",
  "evidence_refs": [
    {
      "kind": "RuntimeLog",
      "uri": "evidence://decision/01J5XKB6/task-envelope",
      "digest": "sha256:task-envelope-01J5XKB6",
      "signature_status": "NotSigned"
    }
  ],
  "observed_at": "2026-08-09T10:16:02Z",
  "signature": "sig_01J5XKB6F9J2M5P8S1V4Y7B0D",
  "supersedes": null
}
